{
  "$schema": "./schemas/action-catalog.schema.json",
  "schema": "egohygiene.relay-action-catalog/v1",
  "schema_version": 1,
  "release_model": {
    "unit": "repository",
    "immutable": "vMAJOR.MINOR.PATCH",
    "moving_alias": "vMAJOR",
    "recommended_consumer_pin": "full-commit-sha"
  },
  "actions": [
    {
      "id": "artifact-budget",
      "path": "actions/artifact-budget",
      "name": "Artifact Size Budget",
      "summary": "Normalize filesystem and Size Limit evidence into deterministic advisory or blocking artifact-budget reports.",
      "status": "beta",
      "runtime": ["bash", "python3"],
      "permissions": {},
      "side_effects": ["workspace-write"],
      "consumer_ref": "egohygiene/relay/actions/artifact-budget@v1"
    },
    {
      "id": "normalize-repository-report",
      "path": "actions/normalize-repository-report",
      "name": "Normalize Repository Report",
      "summary": "Normalize OSV, MegaLinter, and Scorecard output into one public report contract.",
      "status": "beta",
      "runtime": ["bash", "python3"],
      "permissions": {},
      "side_effects": ["workspace-write"],
      "consumer_ref": "egohygiene/relay/actions/normalize-repository-report@v1"
    },
    {
      "id": "preserve-ci-report",
      "path": "actions/preserve-ci-report",
      "name": "Preserve CI Report",
      "summary": "Bind bounded success or failure evidence to a workflow run and preserve it as a checksummed artifact.",
      "status": "beta",
      "runtime": ["bash", "python3"],
      "permissions": {},
      "side_effects": ["artifact-write", "workspace-write"],
      "consumer_ref": "egohygiene/relay/actions/preserve-ci-report@v1"
    },
    {
      "id": "publish-report-snapshot",
      "path": "actions/publish-report-snapshot",
      "name": "Publish Report Snapshot",
      "summary": "Publish guarded, stable .reports snapshots from trusted default-branch jobs.",
      "status": "beta",
      "runtime": ["bash", "git"],
      "permissions": {"contents": "write"},
      "side_effects": ["git-commit", "git-push", "repository-write"],
      "consumer_ref": "egohygiene/relay/actions/publish-report-snapshot@v1"
    },
    {
      "id": "repository-intelligence",
      "path": "actions/repository-intelligence",
      "name": "Repository Intelligence",
      "summary": "Build a deterministic routed intelligence site with operational, roadmap, decision, journey, dependencies, health, releases, work, search, comparison, and analytics views.",
      "status": "beta",
      "runtime": ["bash", "git", "python3"],
      "permissions": {"contents": "read"},
      "side_effects": ["workspace-write"],
      "consumer_ref": "egohygiene/relay/actions/repository-intelligence@v1"
    },
    {
      "id": "repository-intelligence-deployment-provenance",
      "path": "actions/repository-intelligence-deployment-provenance",
      "name": "Repository Intelligence Deployment Provenance",
      "summary": "Verify deterministic Intelligence composition and record separate consumer-owned deployment receipts without deploying.",
      "status": "experimental",
      "runtime": [
        "bash",
        "python3"
      ],
      "permissions": {},
      "side_effects": [
        "workspace-write"
      ],
      "consumer_ref": "egohygiene/relay/actions/repository-intelligence-deployment-provenance@v1"
    },
    {
      "id": "repository-journal",
      "path": "actions/repository-journal",
      "name": "Repository Journal",
      "summary": "Collect bounded GitHub evidence and render deterministic, reviewed-manual, unavailable, or explicitly authorized Copilot journal candidates through a pinned Aether contract.",
      "status": "experimental",
      "runtime": ["bash", "node", "python3"],
      "permissions": {
        "actions": "read",
        "contents": "read",
        "copilot-requests": "write",
        "issues": "read",
        "pull-requests": "read",
        "security-events": "read"
      },
      "side_effects": ["network-read", "workspace-write"],
      "consumer_ref": "egohygiene/relay/actions/repository-journal@v1"
    },
    {
      "id": "repository-continuity-preflight",
      "path": "actions/repository-continuity-preflight",
      "name": "Repository Continuity Preflight",
      "summary": "Run the pinned offline EgoLint continuity capability and emit privacy-safe normalized evidence.",
      "status": "experimental",
      "runtime": ["cargo", "python3"],
      "permissions": {},
      "side_effects": ["workspace-write"],
      "consumer_ref": "egohygiene/relay/actions/repository-continuity-preflight@v1"
    },
    {
      "id": "repository-labels",
      "path": "actions/repository-labels",
      "name": "Repository Labels",
      "summary": "Plan and apply canonical repository labels, pull-request path and size labels, contributor welcomes, and maintainer-edit checks.",
      "status": "beta",
      "runtime": ["bash", "python3", "gh"],
      "permissions": {
        "issues": "write",
        "pull-requests": "write"
      },
      "side_effects": ["repository-write", "workspace-write"],
      "consumer_ref": "egohygiene/relay/actions/repository-labels@v1"
    },
    {
      "id": "stale-pull-requests",
      "path": "actions/stale-pull-requests",
      "name": "Stale Pull Request Lifecycle",
      "summary": "Plan or apply a warning-first pull-request lifecycle with explicit exemptions, bounded evidence, and recoverable closure.",
      "status": "beta",
      "runtime": ["bash", "python3", "gh"],
      "permissions": {
        "issues": "write",
        "pull-requests": "write"
      },
      "side_effects": ["repository-write", "workspace-write"],
      "consumer_ref": "egohygiene/relay/actions/stale-pull-requests@v1"
    },
    {
      "id": "validate-release-bundle",
      "path": "actions/validate-release-bundle",
      "name": "Validate Release Bundle",
      "summary": "Validate profile-bound release bundles, complete checksums, and deterministic immutable evidence without publishing.",
      "status": "beta",
      "runtime": ["bash", "python3"],
      "permissions": {},
      "side_effects": ["workspace-write"],
      "consumer_ref": "egohygiene/relay/actions/validate-release-bundle@v1"
    },
    {
      "id": "verify-release-plan",
      "path": "actions/verify-release-plan",
      "name": "Verify Release Plan",
      "summary": "Verify Aether release intent, authoritative versions, changelog promotion, Git identity, immutable tag state, and optional profile evidence without publishing.",
      "status": "beta",
      "runtime": ["bash", "git", "python3"],
      "permissions": {},
      "side_effects": ["git-network-read", "workspace-write"],
      "consumer_ref": "egohygiene/relay/actions/verify-release-plan@v1"
    },
    {
      "id": "validate-publication-site",
      "path": "actions/validate-publication-site",
      "name": "Validate Publication Site",
      "summary": "Validate caller-built publication hub routes, lifecycle claims, files, and complete checksums without rendering or deploying.",
      "status": "beta",
      "runtime": [
        "bash",
        "python3"
      ],
      "permissions": {},
      "side_effects": [
        "workspace-write"
      ],
      "consumer_ref": "egohygiene/relay/actions/validate-publication-site@v1"
    },
    {
      "id": "verify-publication-pages",
      "path": "actions/verify-publication-pages",
      "name": "Verify Publication Pages",
      "summary": "Verify deployed HTTPS publication routes and every checksummed byte with bounded retries and deterministic evidence.",
      "status": "beta",
      "runtime": [
        "bash",
        "python3"
      ],
      "permissions": {},
      "side_effects": [
        "network-read",
        "workspace-write"
      ],
      "consumer_ref": "egohygiene/relay/actions/verify-publication-pages@v1"
    }
  ],
  "workflows": [
    {
      "id": "artifact-budget",
      "path": ".github/workflows/artifact-budget.yml",
      "name": "Artifact Size Budget",
      "summary": "Download caller-produced size evidence and preserve a deterministic advisory or blocking budget report.",
      "status": "beta",
      "permissions": {"contents": "read"},
      "consumer_ref": "egohygiene/relay/.github/workflows/artifact-budget.yml@v1"
    },
    {
      "id": "continuity-preflight",
      "path": ".github/workflows/continuity-preflight.yml",
      "name": "Repository Continuity Preflight",
      "summary": "Run the local continuity adapter in a least-privilege reusable pull-request workflow.",
      "status": "experimental",
      "permissions": {"contents": "read"},
      "consumer_ref": "egohygiene/relay/.github/workflows/continuity-preflight.yml@v1"
    },
    {
      "id": "label-sync-plan",
      "path": ".github/workflows/label-sync-plan.yml",
      "name": "Repository Label Synchronization Plan",
      "summary": "Compare canonical organization label assignments with live repository labels under read-only authority.",
      "status": "beta",
      "permissions": {
        "contents": "read",
        "issues": "read"
      },
      "consumer_ref": "egohygiene/relay/.github/workflows/label-sync-plan.yml@v1"
    },
    {
      "id": "label-sync-apply",
      "path": ".github/workflows/label-sync-apply.yml",
      "name": "Repository Label Synchronization Apply",
      "summary": "Recompute and apply an exactly reviewed canonical label plan from the caller default branch.",
      "status": "beta",
      "permissions": {
        "contents": "read",
        "issues": "write"
      },
      "consumer_ref": "egohygiene/relay/.github/workflows/label-sync-apply.yml@v1"
    },
    {
      "id": "pull-request-label-plan",
      "path": ".github/workflows/pull-request-label-plan.yml",
      "name": "Pull Request Label Plan",
      "summary": "Plan path labels, size labels, contributor welcomes, and maintainer-edit checks without executing pull-request code.",
      "status": "beta",